{
  "$schema": "https://json-schema.org/draft/2020-12/schema",
  "type": "object",
  "properties": {
    "id": {
      "type": "string",
      "pattern": "^[a-z0-9]+(?:-[a-z0-9]+)*$"
    },
    "slug": {
      "type": "string",
      "pattern": "^[a-z0-9]+(?:-[a-z0-9]+)*$"
    },
    "status": {
      "type": "string",
      "enum": [
        "draft",
        "published",
        "unpublished",
        "archived"
      ]
    },
    "name": {
      "type": "string",
      "minLength": 1
    },
    "english_name": {
      "type": "string",
      "minLength": 1
    },
    "short_description": {
      "type": "string"
    },
    "long_description": {
      "type": "string"
    },
    "llm_description": {
      "type": "string"
    },
    "search_aliases": {
      "type": "array",
      "items": {
        "type": "string"
      }
    },
    "model_numbers": {
      "type": "array",
      "items": {
        "type": "string"
      }
    },
    "offers": {
      "minItems": 1,
      "type": "array",
      "items": {
        "type": "object",
        "properties": {
          "url": {
            "type": "string"
          },
          "channel_id": {
            "type": "string",
            "pattern": "^[a-z0-9]+(?:-[a-z0-9]+)*$"
          },
          "price_text": {
            "type": "string"
          },
          "price": {
            "type": "object",
            "properties": {
              "amount": {
                "anyOf": [
                  {
                    "type": "number"
                  },
                  {
                    "type": "null"
                  }
                ]
              },
              "currency": {
                "anyOf": [
                  {
                    "type": "string",
                    "enum": [
                      "TWD",
                      "JPY",
                      "USD"
                    ]
                  },
                  {
                    "type": "null"
                  }
                ]
              },
              "unit": {
                "anyOf": [
                  {
                    "type": "string",
                    "enum": [
                      "each",
                      "kilogram"
                    ]
                  },
                  {
                    "type": "null"
                  }
                ]
              },
              "label": {
                "anyOf": [
                  {
                    "type": "string"
                  },
                  {
                    "type": "null"
                  }
                ]
              }
            },
            "required": [
              "amount",
              "currency",
              "unit",
              "label"
            ],
            "additionalProperties": false
          },
          "checked_at": {
            "type": "string",
            "pattern": "^\\d{4}-\\d{2}-\\d{2}T\\d{2}:\\d{2}:\\d{2}[+-]\\d{2}:\\d{2}$"
          }
        },
        "required": [
          "url",
          "channel_id",
          "price_text",
          "price",
          "checked_at"
        ],
        "additionalProperties": false
      }
    },
    "image_file": {
      "anyOf": [
        {
          "type": "string"
        },
        {
          "type": "null"
        }
      ]
    },
    "image_url": {
      "anyOf": [
        {
          "type": "string"
        },
        {
          "type": "null"
        }
      ]
    },
    "category_id": {
      "type": "string",
      "pattern": "^[a-z0-9]+(?:-[a-z0-9]+)*$"
    },
    "tag_ids": {
      "type": "array",
      "items": {
        "type": "string",
        "pattern": "^[a-z0-9]+(?:-[a-z0-9]+)*$"
      }
    },
    "reference_links": {
      "type": "array",
      "items": {
        "type": "object",
        "properties": {
          "url": {
            "type": "string"
          },
          "title": {
            "type": "string",
            "minLength": 1
          }
        },
        "required": [
          "url",
          "title"
        ],
        "additionalProperties": false
      }
    },
    "created_at": {
      "type": "string",
      "pattern": "^\\d{4}-\\d{2}-\\d{2}T\\d{2}:\\d{2}:\\d{2}[+-]\\d{2}:\\d{2}$"
    },
    "updated_at": {
      "type": "string",
      "pattern": "^\\d{4}-\\d{2}-\\d{2}T\\d{2}:\\d{2}:\\d{2}[+-]\\d{2}:\\d{2}$"
    },
    "published_at": {
      "anyOf": [
        {
          "type": "string",
          "pattern": "^\\d{4}-\\d{2}-\\d{2}T\\d{2}:\\d{2}:\\d{2}[+-]\\d{2}:\\d{2}$"
        },
        {
          "type": "null"
        }
      ]
    },
    "unpublished_at": {
      "anyOf": [
        {
          "type": "string",
          "pattern": "^\\d{4}-\\d{2}-\\d{2}T\\d{2}:\\d{2}:\\d{2}[+-]\\d{2}:\\d{2}$"
        },
        {
          "type": "null"
        }
      ]
    },
    "archived_at": {
      "anyOf": [
        {
          "type": "string",
          "pattern": "^\\d{4}-\\d{2}-\\d{2}T\\d{2}:\\d{2}:\\d{2}[+-]\\d{2}:\\d{2}$"
        },
        {
          "type": "null"
        }
      ]
    }
  },
  "required": [
    "id",
    "slug",
    "status",
    "name",
    "english_name",
    "short_description",
    "long_description",
    "llm_description",
    "search_aliases",
    "model_numbers",
    "offers",
    "category_id",
    "tag_ids",
    "created_at",
    "updated_at",
    "published_at",
    "unpublished_at",
    "archived_at"
  ],
  "additionalProperties": false
}
