{
  "id": "2026-06-02-electrolux-vacuum-cleaner",
  "slug": "2026-06-02-electrolux-vacuum-cleaner",
  "status": "published",
  "name": "極適家居700濕拖吸塵器",
  "english_name": "Electrolux UltimateHome 700 EFS71423",
  "short_description": "這支的本體跟Q9是一樣的，還多了拖把吸頭，另一組有拖把水桶的也可以考慮  特價的時候會賣到9999，有看到的話請把握機會",
  "long_description": "",
  "llm_description": "## 快速判斷\n\n伊萊克斯極適家居700 EFS71423 是直立式無線濕拖吸塵器，定位在乾吸清潔後可切換 LED 免沾手濕拖吸頭的二合一地板清潔機。它不是洗地機類型的同步吸污水機，而是以無線吸塵器主體搭配濕拖配件，適合硬質地板日常吸塵後補拖。\n\n## 重要規格\n\n- 型號：EFS71423，顏色為沉穩灰。\n- 類型：無線、集塵盒式濕拖吸塵器；官方規格列電壓 25V、馬達功率 185W。\n- 使用時間：手持低速 60 分鐘、低速 53 分鐘、中速 27 分鐘、強速 17 分鐘；充電時間約 270 分鐘／4.5 小時。\n- 過濾：官方標示高效五重過濾，可過濾 0.3～10 微米粒徑 99.9% 細小微塵；momo 規格另列排風口 HEPA 等級濾網。\n- 尺寸與重量：主機 256 × 155 × 1097 mm，產品淨重 2.97 kg。\n- 集塵容量：官方頁列 0.3L；momo 商品規格列 0.4L，購買前可再以包裝或客服確認。\n- 盒內配件：高彈性伸縮軟管、轉角 360 度毛刷吸頭、高處／狹縫清潔伸縮吸頭、小毛刷吸頭、縫隙吸頭、備用濕拖布、LED 免沾手濕拖吸頭。\n\n## 優點與限制\n\n- 主要差異點是乾吸主體搭配濕拖吸頭，吸完地後可改用電動旋轉濕拖系統處理硬質地板污漬。\n- 官方強調封閉式管狀手持主機可降低高轉速噪音，但未在可讀規格中提供分貝值。\n- 強速續航約 17 分鐘，若要清大坪數或長時間高吸力使用，需要留意電量分配。\n- 0.3L／0.4L 級集塵盒容量偏向日常清潔；大量灰塵、毛髮或大坪數環境可能需要中途清空。\n\n## 評測與使用者回饋\n\n- 官方產品頁的 Trustvoice 評論模組顯示整體評分 4.8、108 筆評分、52 則評論，98% 評論者表示推薦；評分分布為 5 星 81%、4 星 15%、3 星 2%、2 星 1%、1 星 1%。\n- 可見官方頁評論常提到機身輕、操作容易，濕拖盤使用便利，能快速切換成手持吸塵器，配件數量多且吸頭更換容易。\n- 清潔表現方面，評論常見正面回饋包括吸力強、續航表現足以應付日常清潔、長髮或毛髮拾取乾淨，以及吸塵後接續濕拖的便利性。\n- 使用限制方面，有評論指出牆邊與角落等銳角位置較不容易拖到；若主要需求是邊角深度拖地，仍需搭配手動補強或其他清潔工具。\n- momo 頁面 HTML 顯示商品評價 4.3，但可讀頁面沒有提供完整評論內容；目前不把單一賣場評分當成品質結論。\n\n## 參考來源\n\n- [Electrolux 官方產品頁：EFS71423](https://www.electrolux.com.tw/appliances/cordless-vacuums/efs71423/)\n- [momo 商品頁：EFS71423](https://www.momoshop.com.tw/goods/GoodsDetail.jsp?i_code=14911447)",
  "search_aliases": [
    "伊萊克斯極適家居700",
    "伊萊克斯 700系列 吸塵濕拖三合一直立濕拖吸塵器",
    "Electrolux EFS71423",
    "UltimateHome 700",
    "EFS71423 沉穩灰"
  ],
  "model_numbers": [
    "EFS71423"
  ],
  "offers": [
    {
      "channel_id": "momo",
      "url": "https://www.momoshop.com.tw/goods/GoodsDetail.jsp?i_code=14911447",
      "price_text": "6,618",
      "price": {
        "amount": 6618,
        "currency": "TWD",
        "unit": "each",
        "label": "限時折後價"
      },
      "checked_at": "2026-06-19T00:00:00+08:00"
    }
  ],
  "image_url": null,
  "category_id": "small-appliance",
  "tag_ids": [
    "cleaning",
    "electrolux"
  ],
  "reference_links": [
    {
      "title": "electrolux 參考頁",
      "url": "https://www.electrolux.com.tw/appliances/cordless-vacuums/efs71423/"
    },
    {
      "title": "Facebook 參考貼文",
      "url": "https://www.facebook.com/applepig/posts/pfbid02D83NeEVfii9EabqoN2S2yCLtaqpb2dBYNw3k5Fx9K2PzkUBBCZpoQw3k4KPKAFMPl"
    }
  ],
  "created_at": "2026-06-02T00:00:00+08:00",
  "updated_at": "2026-07-13T00:00:00+08:00",
  "published_at": "2026-06-02T00:00:00+08:00",
  "unpublished_at": null,
  "archived_at": null,
  "image_file": "2026-06-02-electrolux-vacuum-cleaner.jpg"
}
