{
  "id": "2026-06-02-bose-qc45",
  "slug": "2026-06-02-bose-qc45",
  "status": "published",
  "name": "Bose QuietComfort 耳機",
  "english_name": "Bose QuietComfort Headphones",
  "short_description": "後來出了新的Ultra跟QC（沒有數字），我還沒去試聽",
  "long_description": "後來出了新的Ultra跟QC（沒有數字），我還沒去試聽",
  "llm_description": "## 快速判斷\n\nBose QuietComfort Headphones 是 2023 年推出的非 Ultra 版 Bose over-ear 主動降噪藍牙耳機，官方定位為 QuietComfort 45 Headphones 的後繼款。這筆內容指的是沒有數字、也不是 QuietComfort Ultra 的 Bose QuietComfort Headphones；它保留 QuietComfort 系列的經典摺疊耳罩造型、Bose Music app、Quiet／Aware／Custom 聆聽模式與實體按鍵操作。\n\n如果選購重點是通勤、辦公、飛行時的穩定 ANC、長時間配戴，以及明確想保留耳罩上的實體按鍵控制，這款比 Ultra 更接近傳統 QuietComfort 使用方式。若需求是 Bose 旗艦級 Immersive Audio、CustomTune、ActiveSense 或更進階語音收音，才需要另外看 QuietComfort Ultra。\n\n## 與 QC45、QuietComfort Ultra 的差異\n\n- 與 QC45：Bose 官方 FAQ 明確說 QuietComfort Headphones 是 QuietComfort 45 Headphones 的 successor；Tom’s Guide 也把它描述為 QC45 replacement／upgrade，主要變化包含更新聲音取向、可自訂 ANC 模式、Spotify Tap 與官方標示 24 小時電池續航。\n- 與 QuietComfort Ultra：官方比較表顯示本款沒有 Bose Immersive Audio、ActiveSense 與 CustomTune；Ultra 則是 Bose 更高階、功能更滿的旗艦線。\n- 控制方式：本款保留實體控制。官方 FAQ 說右耳罩背面有 Multi-function button 與音量 +／– 按鍵，左耳罩有 Action button，可切換 Quiet／Aware／Custom Modes 或設定快捷功能；電源／藍牙配對使用滑動開關。\n- 選購提醒：不要把「Bose QuietComfort Headphones」誤買成「Bose QuietComfort Ultra Headphones」或舊款「Bose QuietComfort 45／QC45」。PChome 目前非 Ultra 賣場名稱通常是「QuietComfort 耳罩式藍牙無線消噪耳機」。\n\n## 重要規格\n\n- 產品型號／官方產品 ID：QC-HEADPHONEARN。\n- 類型：around-ear／circumaural 耳罩式無線降噪耳機。\n- 降噪：Active Noise Cancelling；Quiet Mode、Aware Mode、Custom Mode，可在 Bose app 調整模式與 EQ。\n- 控制：右耳罩 Multi-function button、音量 +／–；左耳罩 Action button；支援手機原生語音助理與 Spotify Tap 快捷設定。\n- 連線：Bluetooth 5.1；Tom’s Guide 規格表列出 SBC、AAC；官方 FAQ 標示可同時連接兩台裝置。\n- 有線使用：盒內含 3.5 mm to 2.5 mm audio cable，電池耗盡時仍可被動有線播放，但不會有 ANC 或 Active EQ。\n- 電池：官方規格為最長約 24 小時；充電約 2.5 小時；官方 FAQ 說 15 分鐘快充可提供最長約 4 小時播放。\n- 尺寸與重量：官方規格 7.68 × 6.18 × 3.15 inch，0.520 lb（約 236 g）。\n- 材質：金屬、塑膠、protein leather 耳墊；耳墊可拆換；附收納硬殼。\n- 遊戲限制：官方 FAQ 說不建議用於 gaming，因 Bluetooth audio／video delay 會明顯。\n\n## 優點與限制\n\n- 優點：Bose 經典舒適配戴、強 ANC、可摺疊收納、實體按鍵、可有線播放、USB-C 充電、Bluetooth multipoint 與 app EQ。\n- 限制：Tom’s Guide 指出 ANC 不能完全關閉、沒有 spatial audio mode、缺少 wear detection；官方比較表也顯示本款沒有 Ultra 的 Immersive Audio、CustomTune 與 ActiveSense。\n- Codec 限制：公開評測規格列為 SBC／AAC，未見 aptX、LDAC 等高解析 Bluetooth codec。\n- 價格判斷：台灣 PChome API 查到非 Ultra QuietComfort 黑色／霧白等顏色售價約 NT$8,500；官方美國售價頁面顯示 US$359。\n\n## 評測與使用者回饋\n\n- Tom’s Guide 評測認為這款是 QC45 的升級版，肯定 Bose 降噪、更新聲音、舒適度與比前代更長的電池續航；同時把不能完全關閉 ANC、沒有 spatial audio、缺少 motion／touch controls 列為限制。\n- Tom’s Guide 的 QC45 對比文指出兩款外觀與控制配置非常相近，但新款多了可調 ANC、customizable EQ、Spotify Tap 等功能。\n- Bose 官方產品頁顯示使用者評價約 4.5／5（1,400+ 則），近期評論常見關鍵字包含舒適、控制按鍵反應、Quiet／Aware 切換與聲音表現；這些是官方站內評論，仍應和獨立評測交叉參考。\n- RTINGS 有獨立量測型評測頁，可用來和 Sony WH-1000X 系列、Bose Ultra 或舊 QC45 做 ANC、頻響、延遲與通話表現比較。\n\n## 參考來源\n\n- [Bose 官方 QuietComfort Headphones 產品頁](https://www.bose.com/p/headphones/quietcomfort-acoustic-noise-cancelling-headphones/QC-HEADPHONEARN.html)\n- [Bose QuietComfort Headphones 官方使用者手冊 PDF](https://assets.bosecreative.com/m/4579082941b4e207/original/885443_OG_QC-HEADPHONEARN_en.pdf)\n- [PChome QuietComfort 黑色賣場](https://24h.pchome.com.tw/prod/DGCT18-A900GQD1U)\n- [Tom’s Guide Bose QuietComfort Headphones review](https://www.tomsguide.com/reviews/bose-quietcomfort-headphones)\n- [Tom’s Guide Bose QuietComfort Headphones vs. Bose QuietComfort 45](https://www.tomsguide.com/face-off/bose-quietcomfort-headphones-vs-bose-quietcomfort-45)\n- [RTINGS Bose QuietComfort Headphones Wireless review](https://www.rtings.com/headphones/reviews/bose/quietcomfort-headphones-wireless)",
  "search_aliases": [
    "Bose QuietComfort Headphones",
    "Bose QuietComfort 無線消噪耳機",
    "Bose QuietComfort 耳罩式藍牙無線消噪耳機",
    "Bose QC Headphones",
    "Bose QC 2023",
    "QC-HEADPHONEARN",
    "Bose QC45 後繼",
    "非 Ultra QuietComfort"
  ],
  "model_numbers": [
    "QC-HEADPHONEARN"
  ],
  "offers": [
    {
      "channel_id": "pchome",
      "url": "https://24h.pchome.com.tw/prod/DGCT18-A900GQD1U",
      "price_text": "8500",
      "price": {
        "amount": 8500,
        "currency": "TWD",
        "unit": "each",
        "label": null
      },
      "checked_at": "2026-06-19T00:00:00+08:00"
    }
  ],
  "image_url": null,
  "category_id": "av-theater",
  "tag_ids": [
    "bose",
    "headphone"
  ],
  "reference_links": [
    {
      "title": "bose 參考頁",
      "url": "https://www.bose.com/p/headphones/quietcomfort-acoustic-noise-cancelling-headphones/QC-HEADPHONEARN.html"
    },
    {
      "title": "Facebook 參考貼文（QC45 歷史型號）",
      "url": "https://www.facebook.com/applepig/posts/pfbid02jp4JQkZR4CZhF6vubULYG1TY19B6sCbcP1FoqShhBDtjdH6wZ4xYXtywNAqQhVEFl"
    }
  ],
  "created_at": "2026-06-02T00:00:00+08:00",
  "updated_at": "2026-07-13T00:00:00+08:00",
  "published_at": "2026-06-02T00:00:00+08:00",
  "unpublished_at": null,
  "archived_at": null,
  "image_file": "2026-06-02-bose-qc45.jpg"
}
