{
  "id": "2026-06-02-asahi-ponzu",
  "slug": "2026-06-02-asahi-ponzu",
  "status": "published",
  "name": "旭ポンズ",
  "english_name": "Asahi Ponzu Citrus Soy Sauce",
  "short_description": "在黑門市場的時候被店員大姊推銷，從此一試成主顧的橘醋  大阪附近的話很好買，東京附近的話要找百貨公司超市或成城石井之類的",
  "long_description": "",
  "llm_description": "## 快速判斷\n\n旭ポンズ是大阪八尾「旭食品」的ポン酢しょうゆ，定位是帶柑橘果汁與出汁風味的調味醬油。官方標示以德島縣特產的すだち、ゆこう、ゆず等柑橘果汁為主，搭配醬油、醸造酢、混合削り節、利尻昆布與乾しいたけ，使用時不需稀釋。\n\n## 重要規格\n\n- 品名：ポン酢しょうゆ。\n- 容量：官方列出 360ml 與 1800ml 兩種容量。\n- 原材料含大豆與小麥過敏原；另含混合削り節、利尻昆布、乾しいたけ、調味料、酸味料與カラメル色素。\n- 保存方式：官方建議冷暗所保存；使用前需充分搖勻。\n- 營養標示：每大匙 15ml 約 8kcal、蛋白質 0.7g、脂質 0g、碳水化合物 1.2g、食鹽相當量 1.1g。\n- 適用料理：官方列舉水炊、鍋物、酢の物、肉魚たたき、餃子沾醬，也可用於焼肉與湯豆腐等料理。\n\n## 評測與使用者回饋\n\n- 官方 Rakuten 店 360ml 多入組商品頁顯示 4.85／5、41 件商品評論；可讀評論分布為 5 星 35 件、4 星 6 件，未見 1～3 星評論。\n- 常見正向回饋集中在柑橘香氣、酸味不過度、出汁與醬油感的平衡，以及鍋物、湯豆腐、餃子、炸物、沙拉、蛋飯等用途的泛用性。\n- 多則評論提到長期回購、家庭常備或送禮；也有人指出價格高於一般ポン酢，較像有明顯風味差異的調味品。\n- 評論來源是官方 Rakuten 店的 360ml 多瓶組，能反映同一醬汁產品的使用回饋，但不是單瓶通路頁的獨立評論。\n\n## 適合誰／不適合誰\n\n- 適合想要柑橘香氣明顯、兼有出汁厚度的ポン酢，或需要一瓶可跨鍋物、冷菜、肉魚與餃子沾醬的家庭調味料。\n- 若只需要低單價、大量日常用的普通ポン酢，或需要避開大豆、小麥、魚類出汁成分，購買前要先確認成分與預算。\n\n## 參考來源\n\n- [旭食品官方產品頁](https://www.asahi-syokuhin.co.jp/product/ponzu)\n- [旭ポンズ Rakuten 官方店商品頁](https://item.rakuten.co.jp/asahiponzu/a3-01s/)\n- [Rakuten 商品評論](https://review.rakuten.co.jp/item/1/406639_10000019/1.1/)",
  "search_aliases": [
    "旭ポン酢",
    "旭ぽん酢",
    "Asahi Ponzu",
    "ポン酢しょうゆ",
    "大阪 八尾 旭食品",
    "すだち ゆこう ゆず"
  ],
  "model_numbers": [
    "360ml",
    "1800ml"
  ],
  "offers": [
    {
      "channel_id": "other",
      "url": "https://www.asahi-syokuhin.co.jp/product/ponzu",
      "price_text": "￥840",
      "price": {
        "amount": 840,
        "currency": "JPY",
        "unit": "each",
        "label": null
      },
      "checked_at": "2026-06-02T00:00:00+08:00"
    }
  ],
  "image_url": null,
  "category_id": "household",
  "tag_ids": [
    "asahi-ponzu",
    "food",
    "kitchen"
  ],
  "reference_links": [
    {
      "title": "asahi-syokuhin 參考頁",
      "url": "https://www.asahi-syokuhin.co.jp/product/ponzu"
    }
  ],
  "created_at": "2026-06-02T00:00:00+08:00",
  "updated_at": "2026-06-02T00:00:00+08:00",
  "published_at": "2026-06-02T00:00:00+08:00",
  "unpublished_at": null,
  "archived_at": null,
  "image_file": "2026-06-02-asahi-ponzu.jpg"
}
