{
  "id": "2026-06-02-iris-ohyama-ceiling-light-standard",
  "slug": "2026-06-02-iris-ohyama-ceiling-light-standard",
  "status": "published",
  "name": "IRIS LED 多功能吸頂燈",
  "english_name": "IRIS OHYAMA LED Ceiling Light CL12DL-MFUCT",
  "short_description": "日規吸頂燈真的很棒，可以用遙控調光調色而且還快拆，睡前都不需要爬起來關燈",
  "long_description": "",
  "llm_description": "## 快速判斷\n\nIRIS OHYAMA CL12DL-MFUCT 是 Costco 台灣販售的 LED 多功能吸頂燈，重點是遙控調光調色、整體發光與快拆式配線安裝。可驗證規格顯示最高流明為 5,499 lm，搭配 10 段亮度與 11 段色溫調整，屬於需要一盞主燈覆蓋客廳、臥室或工作房間時可評估的圓盤型吸頂燈。\n\n## 重要規格\n\n- 型號：CL12DL-MFUCT。\n- 光源與調整：LED；可透過遙控器調光／調色，燈泡色到晝光色共 11 段，亮度共 10 段。\n- 最高亮度：5,499 lm。\n- 標示壽命：40,000 小時。\n- 尺寸與重量：直徑 700 mm × 高 127 mm，重量 2.5 kg。\n- 材質：ABS 樹脂、鋼板；顏色為白色。\n- 內容物：LED 吸頂燈本體、配線器、墊圈、安裝板、電線保護圈、遙控器、遙控器座、3 號電池 2 顆、螺絲 6 顆。\n- 產地：中國。\n\n## 優點與限制\n\n- 優點：亮度與色溫可分段調整，適合在同一空間切換閱讀、一般照明與休息情境；遙控器與遙控器座隨附，不需要另外購買基本控制配件。\n- 優點：Costco 商品頁標示為現貨，且 JSON-LD offer 顯示 2026-06-25 前價格有效、TWD 2,699。\n- 限制：可讀資料未列出演色性（CRI）、色溫 K 值範圍、耗電瓦數與防水防潮等級；若要裝在浴室、半戶外或對色彩準確度敏感的工作區，需要再查安裝環境與照明需求。\n- 限制：直徑 700 mm、重量 2.5 kg，安裝前應確認天花板配線器、承重與圓盤尺寸是否適合既有位置。\n\n## 評測與使用者回饋\n\nCostco 商品頁本身可見 Bazaarvoice 評分摘要，顯示平均 4.8／5、共 103 則評論；同一資料來源的產品統計顯示平均分數約 4.77，評分分布為 5 星 86 則、4 星 11 則、3 星 5 則、2 星 1 則，且沒有 ratings-only 評論。\n\n不過，實際展開 Costco 頁面的「商品評價」區塊時，前端容器未穩定渲染逐則評論文字；Bazaarvoice API 第一頁可讀到部分評論紀錄，但多數近期紀錄沒有正文，且後續分頁請求不穩定回 504。因此目前只能確認整體評分摘要與評分分布，不適合把少量可讀文字（例如一則提到最低亮度仍偏亮、小燈又太暗的 2 星意見）整理成「常見」使用者回饋。\n\n## 參考來源\n\n- [Costco 台灣商品頁：IRIS OHYAMA LED 多功能吸頂燈 CL12DL-MFUCT](https://www.costco.com.tw/Home-Improvement/Lighting/Lighting-Light-Bulbs/IRIS-OHYAMA-LED-Ceiling-Light-CL12DL-MFUCT/p/121629)\n- [IRIS OHYAMA 官方網站搜尋／產品資訊入口](https://www.irisohyama.co.jp/search/?q=CL12DL-MFUCT)",
  "search_aliases": [
    "IRIS OHYAMA CL12DL-MFUCT",
    "CL12DL MFUCT",
    "IRIS LED 多功能吸頂燈",
    "愛麗思歐雅瑪吸頂燈",
    "Iris吸頂燈",
    "Costco 121629"
  ],
  "model_numbers": [
    "CL12DL-MFUCT"
  ],
  "offers": [
    {
      "channel_id": "costco",
      "url": "https://www.costco.com.tw/Home-Improvement/Lighting/Lighting-Light-Bulbs/IRIS-OHYAMA-LED-Ceiling-Light-CL12DL-MFUCT/p/121629",
      "price_text": "2699",
      "price": {
        "amount": 2699,
        "currency": "TWD",
        "unit": "each",
        "label": null
      },
      "checked_at": "2026-06-19T00:00:00+08:00"
    }
  ],
  "image_url": null,
  "category_id": "small-appliance",
  "tag_ids": [
    "iris-ohyama",
    "lighting"
  ],
  "reference_links": [
    {
      "title": "Costco 商品頁",
      "url": "https://www.costco.com.tw/Home-Improvement/Lighting/Lighting-Light-Bulbs/IRIS-OHYAMA-LED-Ceiling-Light-CL12DL-MFUCT/p/121629"
    },
    {
      "title": "Facebook 參考貼文",
      "url": "https://www.facebook.com/applepig/posts/pfbid02Ptwb3u65rJMSUAhhiHEXcFmNa2M84TFWtNLaWzEU5AhWHYWcbNweaB23HCxioSmdl"
    }
  ],
  "created_at": "2026-06-02T00:00:00+08:00",
  "updated_at": "2026-07-13T00:00:00+08:00",
  "published_at": "2026-06-02T00:00:00+08:00",
  "unpublished_at": null,
  "archived_at": null,
  "image_file": "2026-06-02-iris-ohyama-ceiling-light-standard.webp"
}
