{
  "id": "2026-06-02-avier-power-bank",
  "slug": "2026-06-02-avier-power-bank",
  "status": "archived",
  "name": "Avier行動電源",
  "english_name": "Avier Power Bank",
  "short_description": "便宜、有雙向PD、但是顏色非常微妙",
  "long_description": "便宜、有雙向PD、但是顏色非常微妙",
  "llm_description": "",
  "search_aliases": [],
  "model_numbers": [],
  "offers": [
    {
      "channel_id": "pchome",
      "url": "https://24h.pchome.com.tw/prod/DYAO44-A900GLJQ6",
      "price_text": "479",
      "price": {
        "amount": 479,
        "currency": "TWD",
        "unit": "each",
        "label": null
      },
      "checked_at": "2026-06-18T00:00:00+08:00"
    }
  ],
  "image_url": null,
  "category_id": "computer-3c",
  "tag_ids": [
    "avier",
    "power-charging"
  ],
  "created_at": "2026-06-02T00:00:00+08:00",
  "updated_at": "2026-06-18T00:00:00+08:00",
  "published_at": "2026-06-02T00:00:00+08:00",
  "unpublished_at": null,
  "archived_at": "2026-06-18T00:00:00+08:00",
  "image_file": "2026-06-02-avier-power-bank.jpg"
}
