{
  "id": "2026-06-02-mitsubishi-heavy-industries-air-conditioner",
  "slug": "2026-06-02-mitsubishi-heavy-industries-air-conditioner",
  "status": "published",
  "name": "三菱重工冷暖空調",
  "english_name": "Mitsubishi Heavy Industries Residential Split Air Conditioners",
  "short_description": "其實Panasonic、日立也都可以買，但是我要稱讚一下三菱重工的遙控器排程功能超級優秀",
  "long_description": "",
  "llm_description": "## 快速判斷\n\n三菱重工冷暖空調在台灣由上洋產業代理，這筆內容比較接近「品牌／家用變頻分離式冷氣系列」而不是單一型號。現行家用一對一壁掛產品包含未來 ZSXT2、晴空 ZST2／ZRT2、朝日 ZTLT2、旭山 ZTNT，以及冷專 YVST／YXST 等系列；購買時要先依坪數、冷暖／冷專、室外機安裝空間與是否需要 Wi-Fi／排程功能選定型號。\n\n## 重要規格與系列差異\n\n- 台灣官網列出的家用一對一壁掛冷房能力約從 2.0kW 到 9.6kW；PChome 同分類頁則以 2–13 坪左右的安裝情境販售多個 SKU。\n- 未來 ZSXT2：冷暖變頻、R32 冷媒、單相 220V／60Hz，官方規格列冷房能力 2.5–6.1kW、CSPF 5.80–7.65、能源分級 1 級，主打 Jet Air 噴射氣流、3D AUTO、左右導風、抗過敏原與奈米淨化濾網。\n- 晴空 ZST2：冷暖變頻，冷房能力 2.0–5.0kW，室內機微風噪音規格低至 19dB，較適合小到中等坪數空間。\n- 晴空 ZRT2：冷暖變頻，冷房能力 6.3–9.6kW，定位較大坪數、長型客餐廳，官方介紹強調最長 20m 送風距離。\n- 朝日 ZTLT2：冷暖變頻，冷房能力 2.2–7.2kW，特色是較輕巧的室內／室外機尺寸、0.5°C 控溫、室外機兩段式靜音模式。\n- 晴空 YVST／YXST：冷專變頻機種，冷房能力 2.5–7.2kW，不提供暖房；若冬季需要熱泵暖氣，應避開冷專系列。\n- 多數壁掛系列支援週定時、溫度預約、自體防霉清潔、LED 亮度調整；Wi-Fi／APP 遠端控制依系列與控制器而定，官方註記 ZRT、71YXST 與吊隱式系列有部分 Wi-Fi 進階功能限制。\n\n## 選購與安裝注意\n\n- 這不是可只看冷房能力就下單的商品：室內機尺寸、室外機尺寸、配管最大長度、室內外高低差、排水路徑與標準安裝銅管長度都會影響實際安裝成本。上洋 FAQ 提到一般業界標準安裝銅管長度約 5m，超過標準長度需購買時與賣家確認。\n- 需要暖房者應選冷暖系列；只需要夏季冷房、且所在地冬季不使用熱泵暖氣時，冷專 YVST／YXST 才是明確分支。\n- 若重視遙控器排程，應確認目標型號是否支援每週每日多組定時；官方頁面對 ZSXT2／ZST2 等系列列有週定時與溫度預約功能，搭配 Wi-Fi 控制器時可有更多排程功能。\n- 2026 年上洋產品頁列出家用變頻空調活動保固條款：家庭用戶購買三菱重工家用變頻空調，全機保固七年、壓縮機保固十五年；非家庭用戶為全機一年。實際仍應以購買當時保證書與通路條款為準。\n\n## 評測與使用者回饋\n\n- PChome 既有 offer 是「三菱重工冷氣」分類頁，不是單一商品頁；頁面可見 56 項商品，前頁價格約 NT$26,700–74,900，但不同坪數、冷暖／冷專與安裝內容差異很大，不宜寫成單一售價。\n- 台灣公開使用者評價在該分類頁分散到個別 SKU，部分商品僅見少量評分數，尚不足以歸納穩定的在地使用者回饋。\n- 澳洲市場的 MHIAA 曾引用 CHOICE 2022 Best Brand 與 ProductReview 2023 split system 獎項；這些可作為品牌在澳洲市場的外部評價參考，但型號、氣候條件、代理服務與台灣販售系列不同，不能直接等同於台灣單一機種評測結論。\n\n## 參考來源\n\n- [三菱重工空調台灣代理上洋：家用一對一變頻壁掛式空調](https://www.heavyduty.com.tw/product/Residential-Single-Split-Wall-Mounted.html)\n- [上洋產品型錄下載：家用變頻空調 2026](https://www.heavyduty.com.tw/product/catalog.html)\n- [上洋使用說明書下載：系列與型號清單](https://www.heavyduty.com.tw/manual-download.html)\n- [三菱重工 Thermal Systems 官方住宅與商用空調分類](https://www.mhi-mth.co.jp/en/products/residential-and-commercial-air-conditioners/)\n- [三菱重工 Thermal Systems 空調 distributor network：Taiwan / Up Young Cornerstone](https://www.mhi-mth.co.jp/en/inquiry/air-conditioners-distributor/)\n- [PChome 三菱重工冷氣分類頁](https://24h.pchome.com.tw/store/DPAF4H)\n- [MHIAA：CHOICE 2022 Best Brand of Air Conditioners](https://www.mhiaa.com.au/choice-best-brand-airconditioner-five-years-in-row/)\n- [MHIAA：2023 ProductReview Award for Bronte split systems](https://www.mhiaa.com.au/bronte-takes-the-win-in-the-2023-productreview-awards/)",
  "search_aliases": [
    "三菱重工冷氣",
    "三菱重工空調",
    "上洋三菱重工",
    "MHI air conditioner",
    "Mitsubishi Heavy Industries AC",
    "未來系列 ZSXT2",
    "晴空系列 ZST2",
    "晴空系列 ZRT2",
    "朝日系列 ZTLT2",
    "旭山系列 ZTNT"
  ],
  "model_numbers": [
    "DXK/DXC ZSXT2",
    "DXK/DXC ZST2",
    "DXK/DXC ZRT2",
    "DXK/DXC ZTLT2",
    "DXK/DXC YVST",
    "DXK/DXC YXST",
    "SRK/SRC ZTNT"
  ],
  "offers": [
    {
      "channel_id": "pchome",
      "url": "https://24h.pchome.com.tw/store/DPAF4H",
      "price_text": "比較貴一點",
      "price": {
        "amount": null,
        "currency": "TWD",
        "unit": "each",
        "label": "比較貴一點"
      },
      "checked_at": "2026-06-19T00:00:00+08:00"
    }
  ],
  "image_url": null,
  "category_id": "major-appliance",
  "tag_ids": [
    "aircon",
    "fixed-install",
    "mitsubishi-heavy-industries"
  ],
  "reference_links": [
    {
      "title": "heavyduty 參考頁",
      "url": "https://www.heavyduty.com.tw/product/Residential-Single-Split-Wall-Mounted.html"
    },
    {
      "title": "Facebook 參考貼文",
      "url": "https://www.facebook.com/applepig/posts/pfbid0JE19pPeNYreLhhjToDt3qCFVGgVuu6h51HVxiHgwNL2rtZ8zBYs9DFzU1dDKhHXKl"
    }
  ],
  "created_at": "2026-06-02T00:00:00+08:00",
  "updated_at": "2026-07-13T00:00:00+08:00",
  "published_at": "2026-06-02T00:00:00+08:00",
  "unpublished_at": null,
  "archived_at": null,
  "image_file": "2026-06-02-mitsubishi-heavy-industries-air-conditioner.jpg"
}
